Item, Config Reference, Document Name, Location
Design Specification, SE_GP17_DesignSpecification, Design Specification.docx, docs/Design Specification
Test Specification, SE_GP17_TestSpecification, Test Specification.docx, docs/Test Specification
User Interface Specification, SE_GP17_UISpecification, UI Specification.docx, docs/User Interface Specification
Maintenance Manual, SE_GP17_MaintenanceManual, Maintenance Manual.docx, docs/Maintenance Manual
End Of Project Report, SE_GP17_FinalReport, Final Report.docx, docs/Final Report
